{
  "bearing_id": "brng_01HXYZ7P3K8MNQR4VWS2YTBCDK",
  "age_band": "10-12",
  "confidence": "attested",
  "issued_at": "2024-01-01T12:00:00Z",
  "expires_at": "2025-01-01T12:00:00Z",
  "issuer": "os:apple",
  "jurisdiction": "US-CA",
  "signature": {
    "alg": "ed25519",
    "value": "FIXTURE_PLACEHOLDER_intentionally_expired_for_negative_test",
    "key_id": "os:apple:conformance-test-2026"
  }
}
