{
  "bearing_id": "brng_01HXYZ7P3K8MNQR4VWS2YTBCDG",
  "age_band": "16-17",
  "confidence": "attested",
  "issued_at": "2026-03-15T12:00:00Z",
  "expires_at": "2027-03-15T12:00:00Z",
  "issuer": "verifier:yoti",
  "jurisdiction": "DE",
  "signature": {
    "alg": "ed25519",
    "value": "FIXTURE_PLACEHOLDER_signed_by_conformance_test_key_eu_de_1617",
    "key_id": "verifier:yoti:conformance-test-2026"
  }
}
